<?xml version="1.0" encoding="UTF-8" standalone="no"?>
<CHARSHEETTEMPLATE menuentryname="ED4 Ulisses Char" filename="ed4_character_sheet_ulisses_ext.pdf" xmlns="http://earthdawn.com/charsheettemplate" xmlns:xsi="http://www.w3.org/2001/XMLSchema-instance" xsi:schemaLocation="http://earthdawn.com/charsheettemplate ../config/charsheettemplate.xsd">
	<CurrentDateTime>Zeitstempel</CurrentDateTime>
	<Name>Name</Name>
	<Race>Rasse</Race>
	<Age>Alter</Age>
	<Eyes>Augenfarbe</Eyes>
	<Gender>Geschlecht</Gender>
	<Hair>Haarfarbe</Hair>
	<Height>Groesse</Height>
	<Skin>Hautfarbe</Skin>
	<Weight>Gewicht</Weight>
	<Passion></Passion>
	<Player></Player>
	<DisciplineName>Disziplin</DisciplineName>
	<DisciplineCircle>Kreis</DisciplineCircle>
	<AttributeBaseDex></AttributeBaseDex>
	<AttributeBaseStr></AttributeBaseStr>
	<AttributeBaseTou></AttributeBaseTou>
	<AttributeBasePer></AttributeBasePer>
	<AttributeBaseWil></AttributeBaseWil>
	<AttributeBaseCha></AttributeBaseCha>
	<AttributeCurrentDex>Geschicklichkeit</AttributeCurrentDex>
	<AttributeCurrentStr>Staerke</AttributeCurrentStr>
	<AttributeCurrentTou>Zaehigkeit</AttributeCurrentTou>
	<AttributeCurrentPer>Warnehmung</AttributeCurrentPer>
	<AttributeCurrentWil>Willenskraft</AttributeCurrentWil>
	<AttributeCurrentCha>Charisma</AttributeCurrentCha>
	<AttributeStepDex>Stufe 1</AttributeStepDex>
	<AttributeStepStr>Stufe 2</AttributeStepStr>
	<AttributeStepTou>Stufe 3</AttributeStepTou>
	<AttributeStepPer>Stufe 4</AttributeStepPer>
	<AttributeStepWil>Stufe 5</AttributeStepWil>
	<AttributeStepCha>Stufe 6</AttributeStepCha>
	<AttributeDiceDex>W rfel 1</AttributeDiceDex>
	<AttributeDiceStr>W rfel 2</AttributeDiceStr>
	<AttributeDiceTou>W rfel 3</AttributeDiceTou>
	<AttributeDicePer>W rfel 4</AttributeDicePer>
	<AttributeDiceWil>W rfel 5</AttributeDiceWil>
	<AttributeDiceCha>W rfel 6</AttributeDiceCha>
	<LpincreaseDex truevalue="Ja" falsevalue="Off">Check Box1</LpincreaseDex>
	<LpincreaseDex truevalue="Ja" falsevalue="Off">Check Box11</LpincreaseDex>
	<LpincreaseDex truevalue="Ja" falsevalue="Off">Check Box12</LpincreaseDex>
	<LpincreaseStr truevalue="Ja" falsevalue="Off">Check Box2</LpincreaseStr>
	<LpincreaseStr truevalue="Ja" falsevalue="Off">Check Box22</LpincreaseStr>
	<LpincreaseStr truevalue="Ja" falsevalue="Off">Check Box23</LpincreaseStr>
	<LpincreaseTou truevalue="Ja" falsevalue="Off">Check Box31</LpincreaseTou>
	<LpincreaseTou truevalue="Ja" falsevalue="Off">Check Box32</LpincreaseTou>
	<LpincreaseTou truevalue="Ja" falsevalue="Off">Check Box33</LpincreaseTou>
	<LpincreasePer truevalue="Ja" falsevalue="Off">Check Box41</LpincreasePer>
	<LpincreasePer truevalue="Ja" falsevalue="Off">Check Box42</LpincreasePer>
	<LpincreasePer truevalue="Ja" falsevalue="Off">Check Box43</LpincreasePer>
	<LpincreaseWil truevalue="Ja" falsevalue="Off">Check Box51</LpincreaseWil>
	<LpincreaseWil truevalue="Ja" falsevalue="Off">Check Box52</LpincreaseWil>
	<LpincreaseWil truevalue="Ja" falsevalue="Off">Check Box53</LpincreaseWil>
	<LpincreaseCha truevalue="Ja" falsevalue="Off">Check Box61</LpincreaseCha>
	<LpincreaseCha truevalue="Ja" falsevalue="Off">Check Box62</LpincreaseCha>
	<LpincreaseCha truevalue="Ja" falsevalue="Off">Check Box63</LpincreaseCha>
	<DefencePhysical>KV</DefencePhysical>
	<DefenceMystic>MV</DefenceMystic>
	<DefenceSocial>SV</DefenceSocial>
	<DeathAdjustment></DeathAdjustment>
	<DeathBase></DeathBase>
	<DeathValue>Todesschwelle</DeathValue>
	<UnconsciousnessAdjustment></UnconsciousnessAdjustment>
	<UnconsciousnessBase></UnconsciousnessBase>
	<UnconsciousnessValue>Bewusstlosigkeitsschwelle</UnconsciousnessValue>
	<RecoveryStep></RecoveryStep>
	<RecoveryDice>WÃ¼rfel</RecoveryDice>
	<RecoveryTestsperday>Erholungsproben/&gt;Tag</RecoveryTestsperday>
	<WoundThreshold>Wundschwelle</WoundThreshold>
	<BloodWound></BloodWound>
	<BloodDamage>Blutschaden</BloodDamage>
	<LegendPointsTotal>Gesamt</LegendPointsTotal>
	<LegendPointsCurrent>Aktuell</LegendPointsCurrent>
	<LegendPointsRenown>Ruhm</LegendPointsRenown>
	<LegendPointsReputation>Ruf</LegendPointsReputation>
	<InitiativeBase>Geschick</InitiativeBase>
	<InitiativeDice></InitiativeDice>
	<InitiativeStep>Modifizierte</InitiativeStep>
	<Talent discipline="1" free="0" other="0" versatility="0"><Name>Text3.0</Name><Action>Text5.0.0</Action><Strain>Text5.0.1</Strain><Attribute>Text4.0.1</Attribute><AttributeStep>Text4.0.2</AttributeStep><Rank>Text4.0.0</Rank><Step>Text4.0.2</Step><Dice>Text4.0.3</Dice><Page></Page></Talent>
	<Talent discipline="1" free="0" other="0" versatility="0"><Name>Text3.1</Name><Action>Text5.1.0</Action><Strain>Text5.1.1</Strain><Attribute>Text4.1.1</Attribute><AttributeStep>Text4.1.2</AttributeStep><Rank>Text4.1.0</Rank><Step>Text4.1.2</Step><Dice>Text4.1.3</Dice><Page></Page></Talent>
	<Talent discipline="1" free="0" other="0" versatility="0"><Name>Text3.2</Name><Action>Text5.2.0</Action><Strain>Text5.2.1</Strain><Attribute>Text4.2.1</Attribute><AttributeStep>Text4.2.2</AttributeStep><Rank>Text4.2.0</Rank><Step>Text4.2.2</Step><Dice>Text4.2.3</Dice><Page></Page></Talent>
	<Talent discipline="1" free="0" other="0" versatility="0"><Name>Text3.3</Name><Action>Text5.3.0</Action><Strain>Text5.3.1</Strain><Attribute>Text4.3.1</Attribute><AttributeStep>Text4.3.2</AttributeStep><Rank>Text4.3.0</Rank><Step>Text4.3.2</Step><Dice>Text4.3.3</Dice><Page></Page></Talent>
	<Talent discipline="1" free="0" other="0" versatility="0"><Name>Text3.4</Name><Action>Text5.4.0</Action><Strain>Text5.4.1</Strain><Attribute>Text4.4.1</Attribute><AttributeStep>Text4.4.2</AttributeStep><Rank>Text4.4.0</Rank><Step>Text4.4.2</Step><Dice>Text4.4.3</Dice><Page></Page></Talent>
	<Talent discipline="1" free="0" other="0" versatility="0"><Name>Text3.5</Name><Action>Text5.5.0</Action><Strain>Text5.5.1</Strain><Attribute>Text4.5.1</Attribute><AttributeStep>Text4.5.2</AttributeStep><Rank>Text4.5.0</Rank><Step>Text4.5.2</Step><Dice>Text4.5.3</Dice><Page></Page></Talent>
	<Talent discipline="1" free="0" other="0" versatility="0"><Name>Text3.6</Name><Action>Text5.6.0</Action><Strain>Text5.6.1</Strain><Attribute>Text4.6.1</Attribute><AttributeStep>Text4.6.2</AttributeStep><Rank>Text4.6.0</Rank><Step>Text4.6.2</Step><Dice>Text4.6.3</Dice><Page></Page></Talent>
	<Talent discipline="1" free="0" other="0" versatility="0"><Name>Text3.7</Name><Action>Text5.7.0</Action><Strain>Text5.7.1</Strain><Attribute>Text4.7.1</Attribute><AttributeStep>Text4.7.2</AttributeStep><Rank>Text4.7.0</Rank><Step>Text4.7.2</Step><Dice>Text4.7.3</Dice><Page></Page></Talent>
	<Talent discipline="1" free="0" other="0" versatility="0"><Name>Text3.8</Name><Action>Text5.8.0</Action><Strain>Text5.8.1</Strain><Attribute>Text4.8.1</Attribute><AttributeStep>Text4.8.2</AttributeStep><Rank>Text4.8.0</Rank><Step>Text4.8.2</Step><Dice>Text4.8.3</Dice><Page></Page></Talent>
	<Talent discipline="1" free="0" other="0" versatility="0"><Name>Text3.9</Name><Action>Text5.9.0</Action><Strain>Text5.9.1</Strain><Attribute>Text4.9.1</Attribute><AttributeStep>Text4.9.2</AttributeStep><Rank>Text4.9.0</Rank><Step>Text4.9.2</Step><Dice>Text4.9.3</Dice><Page></Page></Talent>
	<Talent discipline="1" free="0" other="0" versatility="0"><Name>Text3.10</Name><Action>Text5.10.0</Action><Strain>Text5.10.1</Strain><Attribute>Text4.10.1</Attribute><AttributeStep>Text4.10.2</AttributeStep><Rank>Text4.10.0</Rank><Step>Text4.10.2</Step><Dice>Text4.10.3</Dice><Page></Page></Talent>
	<Talent discipline="1" free="0" other="0" versatility="0"><Name>Text3.11</Name><Action>Text5.11.0</Action><Strain>Text5.11.1</Strain><Attribute>Text4.11.1</Attribute><AttributeStep>Text4.11.2</AttributeStep><Rank>Text4.11.0</Rank><Step>Text4.11.2</Step><Dice>Text4.11.3</Dice><Page></Page></Talent>
	<Talent discipline="1" free="0" other="0" versatility="0"><Name>Text3.12</Name><Action>Text5.12.0</Action><Strain>Text5.12.1</Strain><Attribute>Text4.12.1</Attribute><AttributeStep>Text4.12.2</AttributeStep><Rank>Text4.12.0</Rank><Step>Text4.12.2</Step><Dice>Text4.12.3</Dice><Page></Page></Talent>
	<Talent discipline="1" free="0" other="0" versatility="0"><Name>Text3.13</Name><Action>Text5.13.0</Action><Strain>Text5.13.1</Strain><Attribute>Text4.13.1</Attribute><AttributeStep>Text4.13.2</AttributeStep><Rank>Text4.13.0</Rank><Step>Text4.13.2</Step><Dice>Text4.13.3</Dice><Page></Page></Talent>
	<Talent discipline="1" free="0" other="0" versatility="0"><Name>Text3.14</Name><Action>Text5.14.0</Action><Strain>Text5.14.1</Strain><Attribute>Text4.14.1</Attribute><AttributeStep>Text4.14.2</AttributeStep><Rank>Text4.14.0</Rank><Step>Text4.14.2</Step><Dice>Text4.14.3</Dice><Page></Page></Talent>
	<Talent discipline="1" free="0" other="0" versatility="0"><Name>Text3.15</Name><Action>Text5.15.0</Action><Strain>Text5.15.1</Strain><Attribute>Text4.15.1</Attribute><AttributeStep>Text4.15.2</AttributeStep><Rank>Text4.15.0</Rank><Step>Text4.15.2</Step><Dice>Text4.15.3</Dice><Page></Page></Talent>
	<Talent discipline="1" free="0" other="0" versatility="0"><Name>Text3.16</Name><Action>Text5.16.0</Action><Strain>Text5.16.1</Strain><Attribute>Text4.16.1</Attribute><AttributeStep>Text4.16.2</AttributeStep><Rank>Text4.16.0</Rank><Step>Text4.16.2</Step><Dice>Text4.16.3</Dice><Page></Page></Talent>
	<Talent discipline="1" free="0" other="0" versatility="0"><Name>Text3.17</Name><Action>Text5.17.0</Action><Strain>Text5.17.1</Strain><Attribute>Text4.17.1</Attribute><AttributeStep>Text4.17.2</AttributeStep><Rank>Text4.17.0</Rank><Step>Text4.17.2</Step><Dice>Text4.17.3</Dice><Page></Page></Talent>
	<Talent discipline="1" free="0" other="0" versatility="0"><Name>Text3.18</Name><Action>Text5.18.0</Action><Strain>Text5.18.1</Strain><Attribute>Text4.18.1</Attribute><AttributeStep>Text4.18.2</AttributeStep><Rank>Text4.18.0</Rank><Step>Text4.18.2</Step><Dice>Text4.18.3</Dice><Page></Page></Talent>